"All, I have confirmed that the following invoices for Williams Production RMT Company (""Williams""), were sent under ENA's Demand Letter dated March 1, 2002: Invoice Nos. 020168809 0202142 020169166 01121094 01121761 Please note, the only Invoice not included with ENA's Demand Letter to Williams was: 0203094. Therefore, advise as to whether this invoice also relates to Williams and why it was not included with ENA's letter of March 1st. Further, please advise if the $7,686.87 interest check relates to all the invoices, including Invoice #0203094. Thanks. "
"Dona, I too was just thinking last night how nice it was to see you both days this past weekend--it felt like old times. Once again Suggie and I want to thank you for letting us join you and the girls for the walk in the park. Suggie really enjoyed herself and I am grateful that you all were so patient & kind to her. She is really social and just loved being with the girls. I am looking forward to Lilly's visit--so just let me know where to meet you all on Friday. Thank David for his offer to run the Bear--we will certainly take him up on it. Take care."
"Mark, Unfortunately, I know nothing about our NYMEX agreements as Mark Taylor & Tana Jones managed those agreements in Enron's better days. Is this a type of form???"
"Dona, Am looking forward to our plans to have drinks with Lilly-today. Just let me know where to meet you all. I will need to go home first to check on Sugarbear, as Steve can not get home before 6:30pm. "
"Edward, Attached is 4th part. This is the final part. By receipt of this transmission, you are now in possession of all the electonic/pdf formatted Master Netting Agreements, which were included in the binder delivered to Raj last week. One note of clarification -- I have provided the electronic/pdf version of the Florida Power & Light Company agreement. However, at the time the binder was delivered this agreement had not come my way; therefore, it is not included in the current binder is scheduled to be included a supplemental binder. Please advise if I may be of further assistance. "
"Dona, Ok as to evening drinks. As for Saturday, walking with Lilly while you get your hair done is a good idea. Lunch or something would work for me, but just remembered that I have a facial 4:30pm on Saturday."
"Dona, I had really great time, and hope the remainder of your weekend went well. I would love to join you all this week for drinks with the girls, just let me know the evening. I usually see my trainer on Tuesday & Thursday, but could skip Thursday if that would be one of the drink nights. Also Bear & I would love to go walking again sometime before Lilly leaves."
"Tracie, Many thanks for the attachments. They were most helpful and I was able to complete my task. Thanks again, "
"Rhonda, Thanks for the Southern document. Have you any word on the VEPCO document? Also, please furnish a list and copies of those agreements for Power relating to your arrangements concerning ""payment & close-out netting"" "
"Louis, A Demand Letter did go out to EOTT yesterday, March 20th. This letter was sent by fax yesterday afternoon (March 20th) as well as having gone out by UPS last evening (March 20th)."
"Guys, Please disregard the earlier message, which was sent prior to its completion. This is the complete message. Gentlemen, Attached is the latest version to ENA's form of ""Schedule to ISDA Master Agreement"". This document has been upgraded to include our new ""set-off"" provision. For your convenience, I have attached a redlined version, so you can track the set-off language changes made therein. "
"Gentlemen, Attached is the latest version to ENA's form of ""Schedule to ISDA Master Agreement"". This document has been upgraded to include our new ""set-off"" provision. For your convenience, I have attached a redlined version, so you can track the set-off language changes made therein."
"All, The Legal\Credit Meeting scheduled for Tuesday, November 20th--HAS BEEN CANCELED The next meeting will be held on Tuesday, December 4th."
"Dan, I agree as to your decision to complete the reimbursment for cell phones for year 2001. However, I will NOT use the Four Star card for gasoline purchases any longer, since Mr. D was opposed to this practice. Hey -- have a HAPPY THANKSGIVING. Love you."
"Stephanie, Please add Vladimir Gorny to your list of recipients of the ""Termination Log"". Vladimir works with Jim Fallon & will be working with Ernst/Young to determine the valuations of the terminated relationships. "
"Kelly, I have not provided you with an updated list, so I hope you used my one from last year--it should suffice. Also, please be advised, according to my duties as the Junior League's Outside Board Rep, I am not permitted to assist with any fund raising activities. Therefore, I will attend the Board meeting, but will not stay to write notes."
"Sara, Please let me know if the ISDA Master Agreement between RMT and Enron Japan Corp. is ready for execution. The file is with you for your for initials. You may not have initialed-off on the agreement yet -- because you were going to check with Mark as to possibly adding in the online language. Let me know if I may be of assistance."
